sentence_id,content,ID,S_ID,LENGTH,POL,SUBJ,LEMMA_SENT,POS_SENT,LEMMA_POS,category
1875,De Waalse regering vroeg nog verduidelijkingen over vier punten.,963,1875,10,0.1000000000,0.300000000,de waalse regering vragen nog verduidelijking over vier punt .,DT NNP NN VBD RB NNS IN CD NNS .,de_DT waalse_NNP regering_NN vragen_VBD nog_RB verduidelijking_NNS over_IN vier_CD punt_NNS ._.,UFS
1933,"Dat betekent, mijnheer de minister, dat u niet mag proberen te minimaliseren of de problemen onder de mat te vegen, in de hoop daarmee de bevolking een vals gevoel van veiligheid te geven.",988,1933,37,-0.4333000000,0.566700000,"dat betekenen , mijnheer de minister , dat u niet mogen proberen te minimaliseren of de probleem onder de mat te vegen , in de hoop daarmee de bevolking een vals gevoel van veiligheid te geven .","PRP VBZ , NN DT NN , CC PRP RB MD MD TO VB CC DT NNS IN DT NN TO VB , IN DT NN RB DT NN DT JJ NN IN NN TO VB .","dat_PRP betekenen_VBZ ,_, mijnheer_NN de_DT minister_NN ,_, dat_CC u_PRP niet_RB mogen_MD proberen_MD te_TO minimaliseren_VB of_CC de_DT probleem_NNS onder_IN de_DT mat_NN te_TO vegen_VB ,_, in_IN de_DT hoop_NN daarmee_RB de_DT bevolking_NN een_DT vals_JJ gevoel_NN van_IN veiligheid_NN te_TO geven_VB ._.",NFS
2461,"U begrijpt dat wij dat systeem pas zullen invoeren als wij honderd procent zeker zijn en waarborgen hebben op het vlak van een veilige toegang, de beveiliging van de gegevens en de stemmen, en op het vlak van de capaciteit en de correctheid van het systeem.",1221,2461,49,0.1500000000,0.350000000,"u begrijpen dat wij dat systeem pas zullen invoer als wij honderd procent zeker zijn en waarborg hebben op het vlak van een veilig toegangen , de beveiliging van de gegeven en de stem , en op het vlak van de capaciteit en de correctheid van het systeem .","PRP VBP CC PRP PRP NN RB MD NNS CC PRP CD NN JJ PRP$ CC NNS MD IN PRP NN IN DT JJ VBN , DT NN IN DT NNS CC DT NNS , CC IN PRP NN IN DT NN CC DT NN IN DT NN .","u_PRP begrijpen_VBP dat_CC wij_PRP dat_PRP systeem_NN pas_RB zullen_MD invoer_NNS als_CC wij_PRP honderd_CD procent_NN zeker_JJ zijn_PRP$ en_CC waarborg_NNS hebben_MD op_IN het_PRP vlak_NN van_IN een_DT veilig_JJ toegangen_VBN ,_, de_DT beveiliging_NN van_IN de_DT gegeven_NNS en_CC de_DT stem_NNS ,_, en_CC op_IN het_PRP vlak_NN van_IN de_DT capaciteit_NN en_CC de_DT correctheid_NN van_IN het_DT systeem_NN ._.",NFS
1864,Men mag niet de indruk wekken dat ze er niet toe in staat is te onderhandelen met een land dat slechts 35 miljoen inwoners telt en een belangrijke partner van de francofonie is.,954,1864,34,0.3500000000,0.850000000,men mogen niet de indruk wek dat ze er niet toe in staat zijn te onderhandelen met een land dat slechts 35 miljoen inwoner tellen en een belangrijk partner van de francofonie zijn .,PRP MD RB DT NN NNS CC PRP RB RB IN RP NN MD TO VB IN DT NN PRP RB CD CD NNS VBZ CC DT JJ NN IN DT NN MD .,men_PRP mogen_MD niet_RB de_DT indruk_NN wek_NNS dat_CC ze_PRP er_RB niet_RB toe_IN in_RP staat_NN zijn_MD te_TO onderhandelen_VB met_IN een_DT land_NN dat_PRP slechts_RB 35_CD miljoen_CD inwoner_NNS tellen_VBZ en_CC een_DT belangrijk_JJ partner_NN van_IN de_DT francofonie_NN zijn_MD ._.,NFS
1861,Vanavond vindt er een Europese top over het handelsbeleid van de Europese Unie plaats.,951,1861,15,0.6000000000,1.000000000,vanavond vinden er een europees top over het handelsbeleid van de europees unie plaats .,RB VBZ RB DT JJ NN IN DT NN IN DT JJ NNP NN .,vanavond_RB vinden_VBZ er_RB een_DT europees_JJ top_NN over_IN het_DT handelsbeleid_NN van_IN de_DT europees_JJ unie_NNP plaats_NN ._.,UFS
2318,"Er is natuurlijk expertise nodig, maar de vraag is of het wel gezond is de grensbedragen op te trekken, veeleer dan die expertise bij de overheid zelf te ontwikkelen.",1157,2318,32,0.3417000000,0.500000000,"er zijn natuurlijk expertis nodig , maar de vraag zijn of het wel gezond zijn de grensbedraag op te trekken , veeleer dan die expertise bij de overheid zelf te ontwikkelen .","RB MD JJ JJ JJ , CC DT NN MD CC PRP RB NN MD DT NNS RP TO VB , CC RB PRP NN IN DT NN PRP TO VB .","er_RB zijn_MD natuurlijk_JJ expertis_JJ nodig_JJ ,_, maar_CC de_DT vraag_NN zijn_MD of_CC het_PRP wel_RB gezond_NN zijn_MD de_DT grensbedraag_NNS op_RP te_TO trekken_VB ,_, veeleer_CC dan_RB die_PRP expertise_NN bij_IN de_DT overheid_NN zelf_PRP te_TO ontwikkelen_VB ._.",NFS
2791,Groen heeft al heel veel deksels van die potjes gelicht.,1345,2791,11,0.0944000000,0.622200000,groen hebben al heel veel deksel van die potje lichten .,JJ MD RB RB CD NNS IN PRP NNS VBN .,groen_JJ hebben_MD al_RB heel_RB veel_CD deksel_NNS van_IN die_PRP potje_NNS lichten_VBN ._.,NFS
2044,U knipt in uitgaven waaraan de mensen het meeste nood hebben.,1033,2044,12,0.0000000000,0.000000000,u knippen in uitgaf waaraan de mens het meeste nood hebben .,PRP VBP IN NNS RB DT NNS DT CD NN MD .,u_PRP knippen_VBP in_IN uitgaf_NNS waaraan_RB de_DT mens_NNS het_DT meeste_CD nood_NN hebben_MD ._.,NFS
2858,Volgende week doen we dat.,1378,2858,6,0.0000000000,0.200000000,volgennen week doen we dat .,VBG NN VBP PRP PRP .,volgennen_VBG week_NN doen_VBP we_PRP dat_PRP ._.,NFS
2602,Groot was dan ook mijn verbazing toen ik dinsdagochtend via de radio vernam dat niemand minder dan minister Marghem met Europa zou onderhandelen om de ambitieuze klimaatdoelstellingen te reduceren.,1279,2602,30,0.6333000000,0.850000000,groot zijn dan ook mijn verbazing toen ik dinsdagochten via de radio vernam dat niemand minder dan minister marghem met europa zou onderhandeel om de ambitieus klimaatdoelstelling te reduceren .,JJ MD RB RB PRP$ NN CC PRP VBG IN DT NN NN CC PRP CD RB JJ NNP IN NNP JJ NNS CC DT JJ NNS TO VB .,groot_JJ zijn_MD dan_RB ook_RB mijn_PRP$ verbazing_NN toen_CC ik_PRP dinsdagochten_VBG via_IN de_DT radio_NN vernam_NN dat_CC niemand_PRP minder_CD dan_RB minister_JJ marghem_NNP met_IN europa_NNP zou_JJ onderhandeel_NNS om_CC de_DT ambitieus_JJ klimaatdoelstelling_NNS te_TO reduceren_VB ._.,NFS
1929,Onlangs verscheen er nog een video van Belgische IS-stijders vanuit Mosoel om ons hier te bedreigen.,985,1929,17,0.0000000000,0.000000000,onlangs verschijnen er nog een video van belgisch is-stijder vanuit mosoel om ons hier te bedreigen .,RB VBD RB RB DT NN IN JJ NNS IN NNP CC PRP$ RB TO VBP .,onlangs_RB verschijnen_VBD er_RB nog_RB een_DT video_NN van_IN belgisch_JJ is-stijder_NNS vanuit_IN mosoel_NNP om_CC ons_PRP$ hier_RB te_TO bedreigen_VBP ._.,CFS
2781,En dan het onderzoek ernaar nog proberen te saboteren!,1338,2781,10,0.0000000000,0.000000000,en dan het onderzoek ernaar nog proberen te saboteren !,CC RB DT NN RB RB MD TO VB .,en_CC dan_RB het_DT onderzoek_NN ernaar_RB nog_RB proberen_MD te_TO saboteren_VB !_.,NFS
1916,"Ik meen dat het duidelijk is dat de maatregel, die duizenden jobs zal creëren, de moeite waard is en dat dankzij de maatregel jongeren hun loopbaan en hun toekomst verder vorm zullen kunnen geven.",980,1916,37,0.2167000000,0.433300000,"ik menen dat het duidelijk zijn dat de maatregel , die duizenden job zullen creër , de moeite waard zijn en dat dankzij de maatregel jongeren hun loopbaan en hun toekomst verder vorm zullen kunnen geven .","PRP VBP CC DT JJ MD CC DT NN , PRP CD NNS MD NNS , DT NN NN MD CC PRP IN DT NN JJR PRP$ NN CC PRP$ NN JJR NN MD MD VB .","ik_PRP menen_VBP dat_CC het_DT duidelijk_JJ zijn_MD dat_CC de_DT maatregel_NN ,_, die_PRP duizenden_CD job_NNS zullen_MD creër_NNS ,_, de_DT moeite_NN waard_NN zijn_MD en_CC dat_PRP dankzij_IN de_DT maatregel_NN jongeren_JJR hun_PRP$ loopbaan_NN en_CC hun_PRP$ toekomst_NN verder_JJR vorm_NN zullen_MD kunnen_MD geven_VB ._.",NFS
1950,Wij hebben ook bewezen dat er screenings gebeuren om na te gaan of er in de vluchtelingenstroom mensen zitten met een terroristische intentie.,995,1950,24,-0.5000000000,0.700000000,wij hebben ook bewijzen dat er screening gebeuren om na te gaan of er in de vluchtelingenstroom mens zitten met een terroristisch intentie .,PRP VBP RB VBN CC RB NNS VB CC RP TO VB CC RB IN DT NN NNS VB IN DT JJ NN .,wij_PRP hebben_VBP ook_RB bewijzen_VBN dat_CC er_RB screening_NNS gebeuren_VB om_CC na_RP te_TO gaan_VB of_CC er_RB in_IN de_DT vluchtelingenstroom_NN mens_NNS zitten_VB met_IN een_DT terroristisch_JJ intentie_NN ._.,CFS
2657,"Op 8 juni is het Tax Justice Day, die werd ingevoerd door het Réseau pour la justice fiscale, dat de bijzonder onrechtvaardige praktijken van belastingontwijking en ontduiking aan de kaak stelt: 0,01 % van de belastingplichtigen zou 30 % van de belasting ontduiken en het faciaal tarief van de VenB voor de kmo's is fictief.",1298,2657,59,-0.5400000000,0.700000000,"op 8 juni zijn het tax justice day , die worden invoeren door het réseau pour la justice fiscaal , dat de bijzonder onrechtvaardig praktijk van belastingontwijking en ontduiking aan de kaak stellen : 0,01 % van de belastingplichtigen zullen 30 % van de belasting ontduiken en het faciaal tarief van de venb voor de kmo zijn fictief .","IN CD NNP MD PRP NNP NNP NNP , PRP MD VBN IN DT NNP FW NN NN JJ , CC DT JJ JJ NNS IN NN CC NN IN DT NN VBP . CD NN IN DT DT MD CD NN IN DT NN VBN CC PRP NN NN IN DT NN IN DT NNS MD RB .","op_IN 8_CD juni_NNP zijn_MD het_PRP tax_NNP justice_NNP day_NNP ,_, die_PRP worden_MD invoeren_VBN door_IN het_DT réseau_NNP pour_FW la_NN justice_NN fiscaal_JJ ,_, dat_CC de_DT bijzonder_JJ onrechtvaardig_JJ praktijk_NNS van_IN belastingontwijking_NN en_CC ontduiking_NN aan_IN de_DT kaak_NN stellen_VBP :_. 0,01_CD %_NN van_IN de_DT belastingplichtigen_DT zullen_MD 30_CD %_NN van_IN de_DT belasting_NN ontduiken_VBN en_CC het_PRP faciaal_NN tarief_NN van_IN de_DT venb_NN voor_IN de_DT kmo_NNS zijn_MD fictief_RB ._.",CFS
2755,U moet zich dit eens voorstellen.,1330,2755,7,0.1000000000,0.400000000,u moeten zich dit eens voorstellen .,PRP MD PRP PRP RB VB .,u_PRP moeten_MD zich_PRP dit_PRP eens_RB voorstellen_VB ._.,NFS
2826,Ik heb gisteren aan de Inspectie van Financiën gevraagd om een aantal zaken te onderzoeken.,1364,2826,16,0.0000000000,0.000000000,ik hebben gisteren aan de inspectie van financiën vragen om een aantal zaak te onderzoeken .,PRP MD RB IN DT NNP IN NNP VBN CC DT NN NNS TO VB .,ik_PRP hebben_MD gisteren_RB aan_IN de_DT inspectie_NNP van_IN financiën_NNP vragen_VBN om_CC een_DT aantal_NN zaak_NNS te_TO onderzoeken_VB ._.,UFS
1930,Wij weten dat in Mosoel Belgen aan de zijde van IS meestrijden.,986,1930,13,0.0000000000,0.000000000,wij wijten dat in mosoel belg aan de zijde van is meestrijd .,PRP VBP PRP IN NNP NNS IN DT NN IN NN NNS .,wij_PRP wijten_VBP dat_PRP in_IN mosoel_NNP belg_NNS aan_IN de_DT zijde_NN van_IN is_NN meestrijd_NNS ._.,CFS
2073,"Mijnheer Hedebouw, mevrouw Jiroflée, mevrouw Dedry, dank u voor uw vragen.",1046,2073,15,0.0000000000,0.000000000,"mijnheer hedebouw , mevrouw jiroflée , mevrouw dedry , dank u voor uw vragen .","NN NNP , NN NNP , NN NNP , NN PRP IN PRP$ VB .","mijnheer_NN hedebouw_NNP ,_, mevrouw_NN jiroflée_NNP ,_, mevrouw_NN dedry_NNP ,_, dank_NN u_PRP voor_IN uw_PRP$ vragen_VB ._.",NFS
2416,We zullen deze tekst vol overtuiging onze steun verlenen.,1201,2416,10,0.3000000000,0.625000000,we zullen deze tekst vol overtuiging onze steun verlenen .,PRP MD PRP JJ JJ NN PRP$ NN VB .,we_PRP zullen_MD deze_PRP tekst_JJ vol_JJ overtuiging_NN onze_PRP$ steun_NN verlenen_VB ._.,NFS
2339,U geeft geen nauwkeurig antwoord inzake de werving.,1169,2339,9,-0.2000000000,0.550000000,u geven geen nauwkeurig antwoord inzake de werving .,PRP VBP PRP JJ NN IN DT NN .,u_PRP geven_VBP geen_PRP nauwkeurig_JJ antwoord_NN inzake_IN de_DT werving_NN ._.,NFS
2442,Het is trouwens vreemd dat wij zolang hebben gewacht om Belgen in het buitenland volwaardig stemrecht te verlenen.,1211,2442,19,0.1333000000,0.733300000,het zijn trouwens vreemd dat wij zolang hebben gewacht om belg in het buitenland volwaardig stemrecht te verlenen .,PRP MD RB JJ CC PRP CC MD NN IN NNS IN DT JJ NN NN TO VB .,het_PRP zijn_MD trouwens_RB vreemd_JJ dat_CC wij_PRP zolang_CC hebben_MD gewacht_NN om_IN belg_NNS in_IN het_DT buitenland_JJ volwaardig_NN stemrecht_NN te_TO verlenen_VB ._.,NFS
2457,Dat is wel de ambitie en de bedoeling.,1218,2457,9,0.0000000000,0.000000000,dat zijn wel de ambitie en de bedoeling .,PRP MD RB DT NN CC DT NN .,dat_PRP zijn_MD wel_RB de_DT ambitie_NN en_CC de_DT bedoeling_NN ._.,NFS
1982,Frankrijk heeft daaraan gewerkt en heeft inmiddels een groot aantal minderjarigen die familie hebben in Groot-Brittannië naar daar gebracht.,1010,1982,20,-0.1417000000,0.800000000,frankrijk hebben daaraan werken en hebben inmiddels een groot aantal minderjarigen die familie hebben in groot-brittannië naar daar brengen .,NNP MD RB VBN CC MD RB DT JJ NN JJ PRP NN MD IN NNP IN RB VBN .,frankrijk_NNP hebben_MD daaraan_RB werken_VBN en_CC hebben_MD inmiddels_RB een_DT groot_JJ aantal_NN minderjarigen_JJ die_PRP familie_NN hebben_MD in_IN groot-brittannië_NNP naar_IN daar_RB brengen_VBN ._.,CFS
2433,"Ik heb echter wel bedenkingen bij de aanhechtingscriteria, meer bepaald de versoepeling die daarin wordt gehanteerd.",1208,2433,18,0.2000000000,0.450000000,"ik hebben echter wel bedenking bij de aanhechtingscriteria , meer bepaald de versoepeling die daarin worden hanteren .","PRP MD RB RB NNS IN DT NN , RB RB DT NN PRP RB MD VBN .","ik_PRP hebben_MD echter_RB wel_RB bedenking_NNS bij_IN de_DT aanhechtingscriteria_NN ,_, meer_RB bepaald_RB de_DT versoepeling_NN die_PRP daarin_RB worden_MD hanteren_VBN ._.",NFS
2033,"Het zijn precies de patiënten die niet genoeg geld voor kwalitatieve gezondheidszorg hebben, die hulp zoeken bij die centra.",1026,2033,21,0.4000000000,0.700000000,"het zijn precies de patiënt die niet genoeg geld voor kwalitatief gezondheidszorg hebben , die hulp zoeken bij die centrum .","PRP MD JJ DT NNS PRP RB PRP NN IN JJ NN VBP , PRP NN VBP IN PRP NNS .","het_PRP zijn_MD precies_JJ de_DT patiënt_NNS die_PRP niet_RB genoeg_PRP geld_NN voor_IN kwalitatief_JJ gezondheidszorg_NN hebben_VBP ,_, die_PRP hulp_NN zoeken_VBP bij_IN die_PRP centrum_NNS ._.",CFS
2813,"Over de winteropvang, ik begrijp het onbegrip van alle collega’s die vandaag de vraag hebben gesteld.",1356,2813,20,0.0000000000,0.000000000,"over de winteropvang , ik begrijpen het onbegrip van alle collega ’  die vandaag de vraag hebben stellen .","IN DT NN , PRP VBP DT NN IN PRP NN NN NNS PRP RB DT NN MD VBN .","over_IN de_DT winteropvang_NN ,_, ik_PRP begrijpen_VBP het_DT onbegrip_NN van_IN alle_PRP collega_NN ’_NN _NNS die_PRP vandaag_RB de_DT vraag_NN hebben_MD stellen_VBN ._.",NFS
2420,"Persoonlijk vind ik het jammer dat Belgen niet verplicht zijn om te gaan stemmen, en dat ze zich moeten inschrijven om dat te doen.",1204,2420,26,-0.2250000000,0.675000000,"persoonlijk vinden ik het jammer dat belg niet verplichten zijn om te gaan stemmen , en dat ze zich moeten inschrijven om dat te doen .","JJ VBP PRP DT NN CC NNS RB VBN PRP$ CC TO MD VB , CC CC PRP PRP MD VB CC PRP TO VB .","persoonlijk_JJ vinden_VBP ik_PRP het_DT jammer_NN dat_CC belg_NNS niet_RB verplichten_VBN zijn_PRP$ om_CC te_TO gaan_MD stemmen_VB ,_, en_CC dat_CC ze_PRP zich_PRP moeten_MD inschrijven_VB om_CC dat_PRP te_TO doen_VB ._.",NFS
2764,Zij moeten die zitpenningen terugbetalen.,1334,2764,6,0.0000000000,0.000000000,zij moeten die zitpenning terugbetaal .,PRP MD PRP NNS NNS .,zij_PRP moeten_MD die_PRP zitpenning_NNS terugbetaal_NNS ._.,NFS
2800,"Ik doe dat zelf ook, zoals wellicht heel velen in deze zaal en daarbuiten, om nog te zwijgen van de 1,8 miljoen vrijwilligers die ons land telt.",1350,2800,30,0.1333000000,0.566700000,"ik doen dat zelf ook , zoals wellicht heel velen innen deze zaal en daarbuiten , om nog te zwijgen van de 1,8 miljoen vrijwilliger die ons land tellen .","PRP VBP CC PRP RB , PRP RB RB CD VB PRP NN CC RB , CC RB TO VB IN DT CD CD NNS PRP PRP$ NN VBZ .","ik_PRP doen_VBP dat_CC zelf_PRP ook_RB ,_, zoals_PRP wellicht_RB heel_RB velen_CD innen_VB deze_PRP zaal_NN en_CC daarbuiten_RB ,_, om_CC nog_RB te_TO zwijgen_VB van_IN de_DT 1,8_CD miljoen_CD vrijwilliger_NNS die_PRP ons_PRP$ land_NN tellen_VBZ ._.",CFS
2379,Dit zijn allemaal praktische bezwaren die eigenlijk weggewerkt moeten worden.,1183,2379,11,0.2000000000,0.475000000,dit zijn allemaal praktisch bezwaar die eigenlijk wegwerken moeten worden .,PRP PRP$ DT JJ NNS PRP JJ VBN MD MD .,dit_PRP zijn_PRP$ allemaal_DT praktisch_JJ bezwaar_NNS die_PRP eigenlijk_JJ wegwerken_VBN moeten_MD worden_MD ._.,NFS
2144,U maakt een onderscheid tussen het noorden en het zuiden van het land en dat vind ik onaanvaardbaar.,1079,2144,19,0.0000000000,0.000000000,u maken een onderscheid tussen het noorden en het zuiden van het land en dat vinden ik onaanvaardbaar .,PRP VBP DT NN IN DT NN CC PRP NN IN DT NN CC PRP VBP PRP JJ .,u_PRP maken_VBP een_DT onderscheid_NN tussen_IN het_DT noorden_NN en_CC het_PRP zuiden_NN van_IN het_DT land_NN en_CC dat_PRP vinden_VBP ik_PRP onaanvaardbaar_JJ ._.,NFS
1928,IS heeft alleen al in Mosoel 2 500 Europese strijders.,984,1928,11,0.0000000000,0.000000000,zijn hebben alleen al in mosoel 2 500 europees strijder .,MD MD RB RB IN NNP CD CD JJ NNS .,zijn_MD hebben_MD alleen_RB al_RB in_IN mosoel_NNP 2_CD 500_CD europees_JJ strijder_NNS ._.,CFS
2067,"Door de beslissing om 7 miljoen te besparen, zullen echter 26 geplande wijkgezondheidscentra, die in de startblokken staan, niet kunnen opstarten.",1043,2067,25,0.0000000000,0.000000000,"door de beslissing om 7 miljoen te besparen , zullen echter 26 geplannen wijkgezondheidscentra , die in de startblok staan , niet kunnen opstarten .","IN DT NN CC CD CD TO VB , VBP RB CD VBN NN , PRP IN DT NNS VB , CC MD VBP .","door_IN de_DT beslissing_NN om_CC 7_CD miljoen_CD te_TO besparen_VB ,_, zullen_VBP echter_RB 26_CD geplannen_VBN wijkgezondheidscentra_NN ,_, die_PRP in_IN de_DT startblok_NNS staan_VB ,_, niet_CC kunnen_MD opstarten_VBP ._.",CFS
2225,"Afgelopen zomer stelde u productieve overheidsinvesteringen voor om het GEN te kunnen voltooien, maar sindsdien ligt alles stil, en van het GEN ontbreekt elk spoor in de begroting 2017.",1120,2225,32,-0.0667000000,0.466700000,"aflopen zomer stellen u productief overheidsinvestering voor om het gen te kunnen voltooien , maar sindsdien liggen alles stil , en van het gen ontbreken elk spoor in de begroting 2017 .","VBN NN VBD PRP JJ NNS IN CC DT NN TO MD VB , CC RB VBZ PRP JJ , CC IN DT NN VBZ PRP NN IN DT NN CD .","aflopen_VBN zomer_NN stellen_VBD u_PRP productief_JJ overheidsinvestering_NNS voor_IN om_CC het_DT gen_NN te_TO kunnen_MD voltooien_VB ,_, maar_CC sindsdien_RB liggen_VBZ alles_PRP stil_JJ ,_, en_CC van_IN het_DT gen_NN ontbreken_VBZ elk_PRP spoor_NN in_IN de_DT begroting_NN 2017_CD ._.",CFS
2123,"Ik verzoek u een oplossing uit te werken die de gemeenschappen niet tegen elkaar opzet maar die rekening houdt met de verschillende realiteit in die landsgedeelten, zowel wat de praktijk van de ergotherapeuten, de kinesitherapeuten als de logopedisten betreft, als inzake de erkenning van de psychomotorische therapie als paramedisch beroep.",1070,2123,54,0.0000000000,0.100000000,"ik verzoeken u een oplossing uit te werken die de gemeenschap niet tegen elkaar opzet maar die rekening houden met de verschillende realiteit in die landsgedeelt , zowel wat de praktijk van de ergotherapeut , de kinesitherapeut als de logopedist betreffen , als inzake de erkenning van de psychomotorisch therapie als paramedisch beroep .","PRP VBP PRP DT NN RP TO VB PRP DT NNS RB IN PRP NN CC PRP NN VBZ IN DT PRP NN IN PRP NNS , CC PRP DT NN IN DT NNS , DT NNS CC DT NNS VBZ , PRP IN DT NN IN DT JJ NN PRP JJ NN .","ik_PRP verzoeken_VBP u_PRP een_DT oplossing_NN uit_RP te_TO werken_VB die_PRP de_DT gemeenschap_NNS niet_RB tegen_IN elkaar_PRP opzet_NN maar_CC die_PRP rekening_NN houden_VBZ met_IN de_DT verschillende_PRP realiteit_NN in_IN die_PRP landsgedeelt_NNS ,_, zowel_CC wat_PRP de_DT praktijk_NN van_IN de_DT ergotherapeut_NNS ,_, de_DT kinesitherapeut_NNS als_CC de_DT logopedist_NNS betreffen_VBZ ,_, als_PRP inzake_IN de_DT erkenning_NN van_IN de_DT psychomotorisch_JJ therapie_NN als_PRP paramedisch_JJ beroep_NN ._.",NFS
1911,"Omdat u het vraagt, zal ik herhalen wat de eerste minister gezegd heeft naar aanleiding van zijn verklaring, namelijk dat de regering de impact van de verlaging van het brutoloon van de jongeren zal neutraliseren en ervoor zal zorgen dat het nettoloon van de jongeren niet vermindert.",976,1911,50,-0.6500000000,0.900000000,"omdat u het vragen , zullen ik herhaal wat de eerste minister zeggen hebben naar aanleiding van zijn verklaring , namelijk dat de regering de impact van de verlaging van het brutoloon van de jongeren zullen neutraliseer en ervoor zullen zorg dat het nettoloon van de jongeren niet vermindert .","CC PRP PRP VBP , MD PRP NNS PRP DT CD NN VBN VBZ IN NN NNS MD NN , CC CC DT NN DT NN IN DT NN IN DT NN IN DT JJR MD NNS CC RB MD NNS CC DT NN IN DT JJR RB JJ .","omdat_CC u_PRP het_PRP vragen_VBP ,_, zullen_MD ik_PRP herhaal_NNS wat_PRP de_DT eerste_CD minister_NN zeggen_VBN hebben_VBZ naar_IN aanleiding_NN van_NNS zijn_MD verklaring_NN ,_, namelijk_CC dat_CC de_DT regering_NN de_DT impact_NN van_IN de_DT verlaging_NN van_IN het_DT brutoloon_NN van_IN de_DT jongeren_JJR zullen_MD neutraliseer_NNS en_CC ervoor_RB zullen_MD zorg_NNS dat_CC het_DT nettoloon_NN van_IN de_DT jongeren_JJR niet_RB vermindert_JJ ._.",CFS
1910,Wij zijn van mening dat wij de jongeren zo sneller aan een job zullen kunnen helpen.,975,1910,17,0.0000000000,0.000000000,wij zijn van mening dat wij de jongeren zo sneller aan een job zullen kunnen helpen .,PRP PRP IN NN CC PRP DT JJR RB JJR IN DT NN MD MD VB .,wij_PRP zijn_PRP van_IN mening_NN dat_CC wij_PRP de_DT jongeren_JJR zo_RB sneller_JJR aan_IN een_DT job_NN zullen_MD kunnen_MD helpen_VB ._.,NFS
2383,"Die administratieve vereenvoudiging is voor ons een permanente opdracht, voor de regering, maar eigenlijk voor alle overheden in dit land.",1186,2383,23,0.0500000000,0.350000000,"die administratief vereenvoudiging zijn voor ons een permanent opdracht , voor de regering , maar eigenlijk voor alle overheid innen dit land .","PRP JJ NN MD IN PRP$ DT JJ NN , IN DT NN , CC JJ IN PRP NNS VB PRP NN .","die_PRP administratief_JJ vereenvoudiging_NN zijn_MD voor_IN ons_PRP$ een_DT permanent_JJ opdracht_NN ,_, voor_IN de_DT regering_NN ,_, maar_CC eigenlijk_JJ voor_IN alle_PRP overheid_NNS innen_VB dit_PRP land_NN ._.",NFS
2166,Het advies van het KCE bevat een lijst van te vergoeden slachtoffers.,1090,2166,13,0.0000000000,0.000000000,het advies van het kce bevatten een lijst van te vergoeden slachtoffer .,DT NN IN DT NN VBZ DT NN RP TO VB NNS .,het_DT advies_NN van_IN het_DT kce_NN bevatten_VBZ een_DT lijst_NN van_RP te_TO vergoeden_VB slachtoffer_NNS ._.,CFS
2651,"Mijnheer de eerste minister, deze week dinsdag heeft CD&V een studiedag georganiseerd over onze energievisie met als titel: “De speeltijd is voorbij.” Tijdens die studiedag zijn wij met tientallen stakeholders uit de hele energiesector in dialoog gegaan.",1294,2651,26,0.0667000000,0.383300000,"mijnheer de eerste minister , deze week dinsdag hebben cd&v een studiedag organiseren over onze energievisie met als titel : “ de speeltijd zijn voorbij .","NN DT CD NN , PRP NN NNP MD NN DT NN VBN IN PRP$ NN RP PRP NN . . DT NN MD RP .","mijnheer_NN de_DT eerste_CD minister_NN ,_, deze_PRP week_NN dinsdag_NNP hebben_MD cd&v_NN een_DT studiedag_NN organiseren_VBN over_IN onze_PRP$ energievisie_NN met_RP als_PRP titel_NN :_. “_. de_DT speeltijd_NN zijn_MD voorbij_RP ._.",UFS
1847,"Zo werkt dat in België: grendels, grendels, grendels.",944,1847,12,0.0000000000,0.000000000,"zo werken dat in belgië : grendel , grendel , grendel .","RB VBZ PRP IN NNP . NNS , NNS , NNS .","zo_RB werken_VBZ dat_PRP in_IN belgië_NNP :_. grendel_NNS ,_, grendel_NNS ,_, grendel_NNS ._.",NFS
2026,"Wie geen asiel in ons land wil aanvragen, moet onmiddellijk het bevel krijgen het grondgebied te verlaten.",1022,2026,19,0.0000000000,0.300000000,"wie geen asiel in ons land willen aanvraag , moeten onmiddellijk het bevel krijgen het grondgebied te verlaten .","PRP PRP NN IN PRP$ NN MD NNS , MD JJ DT NN VB DT NN TO VBN .","wie_PRP geen_PRP asiel_NN in_IN ons_PRP$ land_NN willen_MD aanvraag_NNS ,_, moeten_MD onmiddellijk_JJ het_DT bevel_NN krijgen_VB het_DT grondgebied_NN te_TO verlaten_VBN ._.",NFS
2529,"In de amendementen maken wij een uitzondering, op basis van het wederkerigheidsprincipe, voor alle ingezetenen van de Europese Unie.",1253,2529,22,0.0000000000,0.000000000,"in de amendement maken wij een uitzondering , op basis van het wederkerigheidsprincipe , voor alle ingezeteen van de europees unie .","IN DT NNS VB PRP DT NN , IN NN IN DT NN , IN PRP NNS IN DT JJ NNP .","in_IN de_DT amendement_NNS maken_VB wij_PRP een_DT uitzondering_NN ,_, op_IN basis_NN van_IN het_DT wederkerigheidsprincipe_NN ,_, voor_IN alle_PRP ingezeteen_NNS van_IN de_DT europees_JJ unie_NNP ._.",CFS
2075,Maar ook de medische huizen moeten zo doeltreffend mogelijk met de middelen omgaan.,1048,2075,14,0.1150000000,0.440000000,maar ook de medisch huis moeten zo doeltreffend mogelijk met de middeel omgaan .,CC RB DT JJ NNS MD RB JJ JJ IN DT NNS VB .,maar_CC ook_RB de_DT medisch_JJ huis_NNS moeten_MD zo_RB doeltreffend_JJ mogelijk_JJ met_IN de_DT middeel_NNS omgaan_VB ._.,NFS
2487,"Tot mijn verbazing is de minister thans niet aanwezig, maar naar verluidt zal minister Jambon hem vervangen.",1234,2487,19,-0.3500000000,0.600000000,"tot mijn verbazing zijn de minister thans niet aanwezig , maar naar verluiden zullen minister jambon hem vervangen .","IN PRP$ NN MD DT NN RB RB JJ , CC IN VBZ MD NN NNP PRP VBN .","tot_IN mijn_PRP$ verbazing_NN zijn_MD de_DT minister_NN thans_RB niet_RB aanwezig_JJ ,_, maar_CC naar_IN verluiden_VBZ zullen_MD minister_NN jambon_NNP hem_PRP vervangen_VBN ._.",NFS
