sentence_id,content,ID,S_ID,LENGTH,POL,SUBJ,LEMMA_SENT,POS_SENT,LEMMA_POS,category
3440,"Ik heb ook, zoals u terecht zegt, een en ander zondag gecorrigeerd, want wie het interview volledig gelezen heeft, heeft ook gelezen dat het wat mij betreft over rechtvaardigheid gaat, over het rechtvaardig verdelen van de inspanningen.",1604,3440,43,0.2640000000,0.656000000,"ik hebben ook , zoals u terecht zeggen , een en ander zondag corrigeren , want wie het interview volledig lezen hebben , hebben ook lezen dat het wat mij betreffen over rechtvaardigheid gaten , over het rechtvaardig verdelen van de inspanning .","PRP MD RB , CC PRP RB VBP , DT CC PRP NNP VBN , CC PRP DT NN JJ VBN VBZ , MD RB VBN CC DT PRP PRP VBZ IN NN VBZ , IN DT NN VBP IN DT NNS .","ik_PRP hebben_MD ook_RB ,_, zoals_CC u_PRP terecht_RB zeggen_VBP ,_, een_DT en_CC ander_PRP zondag_NNP corrigeren_VBN ,_, want_CC wie_PRP het_DT interview_NN volledig_JJ lezen_VBN hebben_VBZ ,_, hebben_MD ook_RB lezen_VBN dat_CC het_DT wat_PRP mij_PRP betreffen_VBZ over_IN rechtvaardigheid_NN gaten_VBZ ,_, over_IN het_DT rechtvaardig_NN verdelen_VBP van_IN de_DT inspanning_NNS ._.",NFS
4121,"Het is dus mogelijk dat ik iets dubbel zeg, maar de potentiële afspraak was dat wij onder de verslaggevers het werk zouden verdelen om niet telkens dubbele meningen en verslagen te moeten aanhoren.",1870,4121,35,0.0333000000,0.200000000,"het zijn dus mogelijk dat ik iets dubbel zeggen , maar de potentiël afspraak zijn dat wij onder de verslaggever het werk zullen verdelen om niet telkens dubbel mening en verslaag te moeten aanhoren .","PRP MD RB JJ CC PRP PRP NN VBP , CC DT JJ NN MD CC PRP IN DT NNS DT NN MD VBP CC RB RB JJ NNS CC NNS TO MD VB .","het_PRP zijn_MD dus_RB mogelijk_JJ dat_CC ik_PRP iets_PRP dubbel_NN zeggen_VBP ,_, maar_CC de_DT potentiël_JJ afspraak_NN zijn_MD dat_CC wij_PRP onder_IN de_DT verslaggever_NNS het_DT werk_NN zullen_MD verdelen_VBP om_CC niet_RB telkens_RB dubbel_JJ mening_NNS en_CC verslaag_NNS te_TO moeten_MD aanhoren_VB ._.",NFS
4036,"Mijnheer de voorzitter, collega Hedebouw, drie jaar geleden ben ik met de fiets door Cuba gereden.",1830,4036,19,0.0000000000,0.000000000,"mijnheer de voorzitter , collega hedebouw , drie jaar geleden zijn ik met de fiets door cuba rijden .","NN DT NN , NN NNP , CD NN RB MD PRP IN DT NN IN NNP VBN .","mijnheer_NN de_DT voorzitter_NN ,_, collega_NN hedebouw_NNP ,_, drie_CD jaar_NN geleden_RB zijn_MD ik_PRP met_IN de_DT fiets_NN door_IN cuba_NNP rijden_VBN ._.",UFS
3105,U moet nu niet ontkennen dat er plannen zijn.,1472,3105,10,0.0000000000,0.000000000,u moeten nu niet ontkennen dat er plan zijn .,PRP MD RB RB RB CC RB NNS MD .,u_PRP moeten_MD nu_RB niet_RB ontkennen_RB dat_CC er_RB plan_NNS zijn_MD ._.,NFS
3716,Ik vind dat een totaal verkeerd uitgangspunt en ik vind deze uitspraken onaanvaardbaar.,1714,3716,14,-0.7000000000,0.840000000,ik vinden dat een totaal verkeerd uitgangspunt en ik vinden deze uitspraak onaanvaardbaar .,PRP VBP CC DT JJ JJ NN CC PRP VBP PRP NNS JJ .,ik_PRP vinden_VBP dat_CC een_DT totaal_JJ verkeerd_JJ uitgangspunt_NN en_CC ik_PRP vinden_VBP deze_PRP uitspraak_NNS onaanvaardbaar_JJ ._.,NFS
3041,Het plan is daar ontstaan en gerijpt.,1446,3041,8,0.0000000000,0.000000000,het plan zijn daar ontstaan en gerijpt .,DT NN MD RB VBN CC JJ .,het_DT plan_NN zijn_MD daar_RB ontstaan_VBN en_CC gerijpt_JJ ._.,NFS
3770,"Auto's en winkels werden vernield, brandweerlui en politiemensen werden aangevallen.",1734,3770,12,0.0000000000,0.000000000,"auto en winkel worden vernielen , brandweerlui en politiemens worden aanvallen .","NNS CC NNS MD VBN , NN CC NNS MD VBN .","auto_NNS en_CC winkel_NNS worden_MD vernielen_VBN ,_, brandweerlui_NN en_CC politiemens_NNS worden_MD aanvallen_VBN ._.",CFS
3412,U heeft op Facebook een tekst gepost.,1594,3412,8,0.0000000000,0.000000000,u hebben op facebook een tekst posten .,PRP MD IN NNP DT NN VBN .,u_PRP hebben_MD op_IN facebook_NNP een_DT tekst_NN posten_VBN ._.,UFS
2932,Aan dat cijfer moet enige nuance worden aangebracht.,1410,2932,9,0.5500000000,0.800000000,aan dat cijfer moeten enig nuance worden aanbrengen .,RP PRP NN MD JJ NN MD VBN .,aan_RP dat_PRP cijfer_NN moeten_MD enig_JJ nuance_NN worden_MD aanbrengen_VBN ._.,NFS
3657,Bovendien is uw vraag over Mercurius terecht.,1690,3657,8,0.4000000000,0.900000000,bovendien zijn uw vraag over mercurius terecht .,RB MD PRP$ NN IN NNP RB .,bovendien_RB zijn_MD uw_PRP$ vraag_NN over_IN mercurius_NNP terecht_RB ._.,NFS
3470,"Als CD&V ons probeert te doen geloven dat zij het sociaal gelaat van de regering is, wordt het tijd dat wij ons lot in eigen handen nemen en zelf mobiliseren tegen deze regering om die maatregelen niet te nemen.",1616,3470,41,0.1167000000,0.333300000,"als cd&v ons proberen te doen geloven dat zij het sociaal gelaat van de regering zijn , worden het tijd dat wij ons lot in eigen hand nemen en zelf mobiliseer tegen deze regering om die maatregel niet te nemen .","PRP NN PRP$ MD TO VB VB CC PRP DT JJ NN IN DT NN MD , MD PRP NN CC PRP PRP$ NN IN PRP NNS VB CC PRP NNS VB PRP NN CC PRP NNS RB TO VB .","als_PRP cd&v_NN ons_PRP$ proberen_MD te_TO doen_VB geloven_VB dat_CC zij_PRP het_DT sociaal_JJ gelaat_NN van_IN de_DT regering_NN zijn_MD ,_, worden_MD het_PRP tijd_NN dat_CC wij_PRP ons_PRP$ lot_NN in_IN eigen_PRP hand_NNS nemen_VB en_CC zelf_PRP mobiliseer_NNS tegen_VB deze_PRP regering_NN om_CC die_PRP maatregel_NNS niet_RB te_TO nemen_VB ._.",NFS
4001,De kernuitstap in 2025 is voor CD&V het uitgangspunt van dat energiepact.,1820,4001,13,0.0000000000,0.000000000,de kernuitstap in 2025 zijn voor cd&v het uitgangspunt van dat energiepact .,DT NN IN CD MD IN NN DT NN RP PRP NN .,de_DT kernuitstap_NN in_IN 2025_CD zijn_MD voor_IN cd&v_NN het_DT uitgangspunt_NN van_RP dat_PRP energiepact_NN ._.,NFS
3892,Over één zaak was u wel al duidelijk.,1787,3892,9,0.4500000000,0.600000000,over één zaak zijn u wel al duidelijk .,IN CD NN MD PRP RB RB JJ .,over_IN één_CD zaak_NN zijn_MD u_PRP wel_RB al_RB duidelijk_JJ ._.,NFS
3959,De heer Demon doet de deur van de communautaire frigo open.,1806,3959,12,0.2000000000,0.466700000,de heer demon doen de deur van de communautair frigo open .,DT NN NNP VBZ DT NN IN DT JJ NN JJ .,de_DT heer_NN demon_NNP doen_VBZ de_DT deur_NN van_IN de_DT communautair_JJ frigo_NN open_JJ ._.,NFS
4156,"Als er geen economie meer is, is er uiteraard ook geen fraude.",1884,4156,14,0.0000000000,0.000000000,"als er geen economie meer zijn , zijn er uiteraard ook geen fraude .","CC RB PRP NN RB MD , MD RB RB RB PRP NN .","als_CC er_RB geen_PRP economie_NN meer_RB zijn_MD ,_, zijn_MD er_RB uiteraard_RB ook_RB geen_PRP fraude_NN ._.",UFS
3186,"Als u denkt dat dit de middenklasse is, dan nodig ik u uit om wat meer buiten te komen en te praten met de mensen, want dat is niet de middenklasse.",1512,3186,34,0.2500000000,0.350000000,"als u denken dat dit de middenklas zijn , dan nodig ik u uit om wat meer buiten te komen en te praten met de mens , want dat zijn niet de middenklasse .","PRP PRP VBP CC PRP DT JJ MD , RB JJ PRP PRP IN CC PRP RB RB TO VB CC TO VBP IN DT NNS , CC PRP MD RB DT NN .","als_PRP u_PRP denken_VBP dat_CC dit_PRP de_DT middenklas_JJ zijn_MD ,_, dan_RB nodig_JJ ik_PRP u_PRP uit_IN om_CC wat_PRP meer_RB buiten_RB te_TO komen_VB en_CC te_TO praten_VBP met_IN de_DT mens_NNS ,_, want_CC dat_PRP zijn_MD niet_RB de_DT middenklasse_NN ._.",NFS
4044,"Ook de keuze die Elia naar voren schuift om de restcapaciteit in gas te voorzien, zal een enorme uitdaging zijn.",1833,4044,22,0.0250000000,0.950000000,"ook de keuze die elia naar voren schuiven om de restcapaciteit in gas te voorzien , zullen een enorm uitdaging zijn .","RB DT NN PRP NNP IN RB VBZ CC DT NN IN NN TO VB , MD DT JJ NN MD .","ook_RB de_DT keuze_NN die_PRP elia_NNP naar_IN voren_RB schuiven_VBZ om_CC de_DT restcapaciteit_NN in_IN gas_NN te_TO voorzien_VB ,_, zullen_MD een_DT enorm_JJ uitdaging_NN zijn_MD ._.",NFS
3615,"Het antwoord van de regering, mijnheer de minister, is echt beneden alle peil.",1676,3615,16,0.2000000000,0.400000000,"het antwoord van de regering , mijnheer de minister , zijn echt beneden alle peil .","DT NN IN DT NN , NN DT NN , MD JJ RB PRP NN .","het_DT antwoord_NN van_IN de_DT regering_NN ,_, mijnheer_NN de_DT minister_NN ,_, zijn_MD echt_JJ beneden_RB alle_PRP peil_NN ._.",NFS
2909,Niet ieder mens met veel geld is per definitie een fraudeur.,1399,2909,12,0.0000000000,0.000000000,niet ieder mens met veel geld zijn per definitie een fraudeur .,RB PRP NN IN CD NN MD IN NN DT NN .,niet_RB ieder_PRP mens_NN met_IN veel_CD geld_NN zijn_MD per_IN definitie_NN een_DT fraudeur_NN ._.,NFS
4048,Hopelijk biedt het een duidelijk kader.,1834,4048,7,0.4500000000,0.600000000,hopelijk bieden het een duidelijk kader .,JJ VBZ PRP DT JJ NN .,hopelijk_JJ bieden_VBZ het_PRP een_DT duidelijk_JJ kader_NN ._.,NFS
3247,De regeling moet goed zijn voor de consument of ze moet fraude tegengaan.,1540,3247,14,0.5500000000,0.900000000,de regeling moeten goed zijn voor de consument of ze moeten fraud tegengaan .,DT NN MD JJ PRP IN DT NN CC PRP MD JJ VB .,de_DT regeling_NN moeten_MD goed_JJ zijn_PRP voor_IN de_DT consument_NN of_CC ze_PRP moeten_MD fraud_JJ tegengaan_VB ._.,NFS
3556,"Mijnheer de minister, een auto aankopen is een heel belangrijke beslissing.",1654,3556,13,0.5600000000,1.000000000,"mijnheer de minister , een auto aankoop zijn een heel belangrijk beslissing .","NN DT NN , DT NN NNS MD DT RB JJ NN .","mijnheer_NN de_DT minister_NN ,_, een_DT auto_NN aankoop_NNS zijn_MD een_DT heel_RB belangrijk_JJ beslissing_NN ._.",NFS
4101,"Mijnheer de voorzitter, ik ontwaar hier weinig verslag en veeleer een betoog, wat ik overigens voor honderd procent apprecieer.",1864,4101,22,0.0000000000,0.000000000,"mijnheer de voorzitter , ik ontwaren hier weinig verslag en veeleer een betoog , wat ik overigens voor honderd procent apprecieer .","NN DT NN , PRP VBP RB CD NN CC RB DT NN , PRP PRP RB IN CD NN NN .","mijnheer_NN de_DT voorzitter_NN ,_, ik_PRP ontwaren_VBP hier_RB weinig_CD verslag_NN en_CC veeleer_RB een_DT betoog_NN ,_, wat_PRP ik_PRP overigens_RB voor_IN honderd_CD procent_NN apprecieer_NN ._.",NFS
3406,"Mijn vraag aan u is heel duidelijk, mijnheer de minister.",1592,3406,12,0.7200000000,0.960000000,"mijn vraag aan u zijn heel duidelijk , mijnheer de minister .","PRP$ NN IN PRP MD RB JJ , NN DT NN .","mijn_PRP$ vraag_NN aan_IN u_PRP zijn_MD heel_RB duidelijk_JJ ,_, mijnheer_NN de_DT minister_NN ._.",NFS
4122,"Ik zal mij dus beperken tot de hoofdstukken I, II en III en het gedeelte kaaimantaks uit hoofdstuk IV.",1871,4122,21,0.0000000000,0.000000000,"ik zullen mij dus beperken tot de hoofdstuk i , ii en iii en het gedeelte kaaimantak uit hoofdstuk iv .","PRP MD PRP RB VB IN DT NNS FW , NN CC NN CC PRP NN NNS IN NN NNP .","ik_PRP zullen_MD mij_PRP dus_RB beperken_VB tot_IN de_DT hoofdstuk_NNS i_FW ,_, ii_NN en_CC iii_NN en_CC het_PRP gedeelte_NN kaaimantak_NNS uit_IN hoofdstuk_NN iv_NNP ._.",NFS
3533,Eigenlijk heeft de consument daarvan geen weet.,1649,3533,8,0.0000000000,0.300000000,eigenlijk hebben de consument daarvan geen wijten .,JJ MD DT NN RB PRP VBP .,eigenlijk_JJ hebben_MD de_DT consument_NN daarvan_RB geen_PRP wijten_VBP ._.,NFS
3496,"Het is Didier Reynders, die aan de federale regering heeft voorgesteld met de betrokken ministers een taskforce te organiseren, teneinde zo snel mogelijk alle krachten te verzamelen en met de betrokken sectoren te overleggen.",1629,3496,37,0.0333000000,0.466700000,"het zijn didier reynders , die aan de federaal regering hebben voorstellen met de betrekken minister een taskforce te organiseren , teneinde zo snel mogelijk alle kracht te verzamelen en met de betrekken sector te overleggen .","PRP MD NNP NNP , PRP IN DT JJ NN MD VBN IN DT VBN NNS DT NN TO VB , CC RB JJ JJ PRP NNS TO VB CC IN DT VBN NNS TO VB .","het_PRP zijn_MD didier_NNP reynders_NNP ,_, die_PRP aan_IN de_DT federaal_JJ regering_NN hebben_MD voorstellen_VBN met_IN de_DT betrekken_VBN minister_NNS een_DT taskforce_NN te_TO organiseren_VB ,_, teneinde_CC zo_RB snel_JJ mogelijk_JJ alle_PRP kracht_NNS te_TO verzamelen_VB en_CC met_IN de_DT betrekken_VBN sector_NNS te_TO overleggen_VB ._.",CFS
3028,"Mijnheer de voorzitter, we hebben de tijd.",1440,3028,9,0.0000000000,0.000000000,"mijnheer de voorzitter , we hebben de tijd .","NN DT NN , PRP MD DT NN .","mijnheer_NN de_DT voorzitter_NN ,_, we_PRP hebben_MD de_DT tijd_NN ._.",NFS
3241,"De vraag was immers eigenlijk aan minister Kris Peeters gericht, die u naar hier heeft gestuurd.",1539,3241,18,-0.3250000000,0.600000000,"de vraag zijn immers eigenlijk aan minister kris peeters richten , die u naar hier hebben sturen .","DT NN MD RB JJ IN NN NNP NNP VBN , PRP PRP IN RB MD VBN .","de_DT vraag_NN zijn_MD immers_RB eigenlijk_JJ aan_IN minister_NN kris_NNP peeters_NNP richten_VBN ,_, die_PRP u_PRP naar_IN hier_RB hebben_MD sturen_VBN ._.",NFS
4076,"Wat ons interesseert, is dat de thuisverpleging, die het al zo moeilijk heeft, daardoor vandaag enorm veel tijd verliest aan die administratieve rompslomp.",1847,4076,27,0.1500000000,1.000000000,"wat ons interesseren , zijn dat de thuisverpleging , die het al zo moeilijk hebben , daardoor vandaag enorm veel tijd verliezen aan die administratief rompslomp .","PRP PRP$ VBZ , MD CC DT NN , PRP PRP RB RB JJ VBZ , RB RB JJ CD NN VBZ IN PRP JJ NN .","wat_PRP ons_PRP$ interesseren_VBZ ,_, zijn_MD dat_CC de_DT thuisverpleging_NN ,_, die_PRP het_PRP al_RB zo_RB moeilijk_JJ hebben_VBZ ,_, daardoor_RB vandaag_RB enorm_JJ veel_CD tijd_NN verliezen_VBZ aan_IN die_PRP administratief_JJ rompslomp_NN ._.",NFS
3049,"Wat die war on drugs in de Antwerpse straten betreft, worden de kleintjes inderdaad gepakt.",1450,3049,17,0.0000000000,0.000000000,"wat die war on drug in de antwerpse straat betreffen , worden de kleintje inderdaad pakken .","PRP PRP NN JJ NNS IN DT NNP NNS VBZ , MD DT NNS RB VBN .","wat_PRP die_PRP war_NN on_JJ drug_NNS in_IN de_DT antwerpse_NNP straat_NNS betreffen_VBZ ,_, worden_MD de_DT kleintje_NNS inderdaad_RB pakken_VBN ._.",NFS
3081,Laat ons vooruitkijken naar 12 oktober en dan bekijken of dit voldoende is.,1464,3081,14,-0.2167000000,0.733300000,laten ons vooruitkijk naar 12 oktober en dan bekijken of dit voldoende zijn .,MD PRP$ NNS IN CD NNP CC RB VBP CC PRP PRP MD .,laten_MD ons_PRP$ vooruitkijk_NNS naar_IN 12_CD oktober_NNP en_CC dan_RB bekijken_VBP of_CC dit_PRP voldoende_PRP zijn_MD ._.,NFS
3475,"Ik herhaal, het kan vandaag al en het stond ook in het regeerakkoord van Di Rupo waarnaar u verwijst.",1618,3475,21,0.0000000000,0.000000000,"ik herhalen , het kunnen vandaag al en het staan ook in het regeerakkoord van di rupo waarnaar u verwijzen .","PRP VBP , PRP MD RB JJ CC PRP VBD RB IN DT NN IN NNP NNP RB PRP VBP .","ik_PRP herhalen_VBP ,_, het_PRP kunnen_MD vandaag_RB al_JJ en_CC het_PRP staan_VBD ook_RB in_IN het_DT regeerakkoord_NN van_IN di_NNP rupo_NNP waarnaar_RB u_PRP verwijzen_VBP ._.",CFS
3422,"Het wordt mooi verkocht: langer werken in de winter, meer thuisblijven in de zomer.",1596,3422,17,0.3500000000,0.550000000,"het worden mooi verkopen : langer werken in de winter , meer thuisblijf in de zomer .","PRP MD JJ VBN . JJR VB IN DT NN , CD NNS IN DT NN .","het_PRP worden_MD mooi_JJ verkopen_VBN :_. langer_JJR werken_VB in_IN de_DT winter_NN ,_, meer_CD thuisblijf_NNS in_IN de_DT zomer_NN ._.",NFS
3815,"De afgelopen jaren stelden wij een resem zware feiten vast, in het bijzonder tegen onze politiemensen.",1750,3815,18,0.1583000000,0.572200000,"de aflopen jaar steld wij een resem zwaar feit vast , in het bijzonder tegen onze politiemens .","DT VBN NNS NNS PRP DT NN JJ NNS JJ , IN DT JJ IN PRP$ NNS .","de_DT aflopen_VBN jaar_NNS steld_NNS wij_PRP een_DT resem_NN zwaar_JJ feit_NNS vast_JJ ,_, in_IN het_DT bijzonder_JJ tegen_IN onze_PRP$ politiemens_NNS ._.",NFS
3033,Eveneens waar is – dat ziet men vaak bij criminaliteitfenomenen – dat de modus operandi wijzigt wanneer men sterk op een bepaald fenomeen inzet.,1442,3033,25,0.3111000000,0.572200000,eveneens waar zijn – dat zien men vaak bij criminaliteitfenomeen – dat de modus operandi wijzigen wanneer men sterk op een bepaald fenomeen inzet .,RB RB MD RB PRP VBZ PRP RB IN NNS NN CC DT NN NN VBZ CC PRP JJ IN DT NN NN NN .,eveneens_RB waar_RB zijn_MD –_RB dat_PRP zien_VBZ men_PRP vaak_RB bij_IN criminaliteitfenomeen_NNS –_NN dat_CC de_DT modus_NN operandi_NN wijzigen_VBZ wanneer_CC men_PRP sterk_JJ op_IN een_DT bepaald_NN fenomeen_NN inzet_NN ._.,CFS
3519,Ik dank u voor de bestaande ondersteuningsmaatregelen; gelet op de zeer zware impact van de terreuraanslagen zullen er zeker ook bijkomende maatregelen moeten worden genomen.,1640,3519,27,0.0812000000,0.580000000,ik danken u voor de bestaand ondersteuningsmaatregel ; letten op de zeer zwaar impact van de terreuraanslaag zullen er zeker ook bijkomennen maatregel moeten worden nemen .,"PRP VBP PRP IN DT JJ NNS , VBN IN DT NN JJ NN IN DT NNS MD RB JJ RB VBG NNS MD MD VBN .","ik_PRP danken_VBP u_PRP voor_IN de_DT bestaand_JJ ondersteuningsmaatregel_NNS ;_, letten_VBN op_IN de_DT zeer_NN zwaar_JJ impact_NN van_IN de_DT terreuraanslaag_NNS zullen_MD er_RB zeker_JJ ook_RB bijkomennen_VBG maatregel_NNS moeten_MD worden_MD nemen_VBN ._.",NFS
3608,"Maar inzake nucleaire veiligheid moeten de problemen er blijkbaar echt zijn, vooraleer men actie onderneemt.",1674,3608,17,0.0000000000,0.300000000,"maar inzake nucleair veiligheid moeten de probleem er blijkbaar echt zijn , vooraleer men actie ondernemen .","CC IN JJ NN MD DT NNS RB RB JJ MD , NN DT NN VBZ .","maar_CC inzake_IN nucleair_JJ veiligheid_NN moeten_MD de_DT probleem_NNS er_RB blijkbaar_RB echt_JJ zijn_MD ,_, vooraleer_NN men_DT actie_NN ondernemen_VBZ ._.",NFS
4033,De vraag is dus — dat is wat in het rapport van Elia staat — waarom er nu onvoldoende maatregelen worden genomen om in 2025 te beschikken over andere capaciteiten.,1828,4033,31,-0.2000000000,0.450000000,de vraag zijn dus — dat zijn wat in het rapport van elia staan — waarom er nu onvoldoend maatregel worden nemen om in 2025 te beschikken over andere capaciteit .,DT NN MD RB JJ PRP MD PRP IN DT NN IN NNP VBZ NN RB RB RB JJ NNS MD VBN CC IN CD TO VBP IN PRP NNS .,de_DT vraag_NN zijn_MD dus_RB —_JJ dat_PRP zijn_MD wat_PRP in_IN het_DT rapport_NN van_IN elia_NNP staan_VBZ —_NN waarom_RB er_RB nu_RB onvoldoend_JJ maatregel_NNS worden_MD nemen_VBN om_CC in_IN 2025_CD te_TO beschikken_VBP over_IN andere_PRP capaciteit_NNS ._.,CFS
3386,Dat geef ik u als idee mee.,1585,3386,8,0.0000000000,0.000000000,dat geven ik u als idee mee .,PRP VBP PRP PRP PRP NN RP .,dat_PRP geven_VBP ik_PRP u_PRP als_PRP idee_NN mee_RP ._.,UFS
3643,"Het gevoel van straffeloosheid, de negatieve en nefaste spiraal, moet dringend worden omgebogen.",1688,3643,16,-0.5000000000,0.800000000,"het gevoel van straffeloosheid , de negatief en nefast spiraal , moeten dringend worden ombuigen .","DT NN IN NN , DT JJ CC JJS NN , MD RB MD VBN .","het_DT gevoel_NN van_IN straffeloosheid_NN ,_, de_DT negatief_JJ en_CC nefast_JJS spiraal_NN ,_, moeten_MD dringend_RB worden_MD ombuigen_VBN ._.",NFS
4097,Ik heb gezien dat u begrip hebt voor de invoering in de sector van het elektronisch voorschrift door artsen.,1861,4097,20,0.0000000000,0.000000000,ik hebben zien dat u begrip hebben voor de invoering in de sector van het elektronisch voorschrift door arts .,PRP MD VBN CC PRP NN VBP IN DT NN IN DT NN IN DT NN NN IN NNS .,ik_PRP hebben_MD zien_VBN dat_CC u_PRP begrip_NN hebben_VBP voor_IN de_DT invoering_NN in_IN de_DT sector_NN van_IN het_DT elektronisch_NN voorschrift_NN door_IN arts_NNS ._.,NFS
3882,"Voor echte normstelling, voor harde handhaving is net iets meer nodig dan wat de vorige regeringen en de huidige regering doen, zoals de Brusselse kerstmarkt omdopen in een winterfeest en Marokkaanse officials feliciteren, omdat ze afstand nemen van een dergelijk crimineel gedrag.",1782,3882,46,0.0750000000,0.400000000,"voor echt normstelling , voor hard handhaving zijn net iets meer nodig dan wat de vorig regering en de huidig regering doen , zoals de brussels kerstmarken omdoop in een winterfeest en marokkaanse official feliciteer , omdat ze afstand nemen van een dergelijk crimineel gedrag .","IN JJ NN , IN JJ NN MD RB PRP RB JJ CC PRP DT JJ NNS CC DT JJ NN VB , CC DT JJ VBN NNS IN DT NN CC NNP NNS NNS , CC PRP NN VB IN DT PRP JJ NN .","voor_IN echt_JJ normstelling_NN ,_, voor_IN hard_JJ handhaving_NN zijn_MD net_RB iets_PRP meer_RB nodig_JJ dan_CC wat_PRP de_DT vorig_JJ regering_NNS en_CC de_DT huidig_JJ regering_NN doen_VB ,_, zoals_CC de_DT brussels_JJ kerstmarken_VBN omdoop_NNS in_IN een_DT winterfeest_NN en_CC marokkaanse_NNP official_NNS feliciteer_NNS ,_, omdat_CC ze_PRP afstand_NN nemen_VB van_IN een_DT dergelijk_PRP crimineel_JJ gedrag_NN ._.",NFS
3681,Dat brengt mij automatisch bij een aantal duidelijke vragen.,1702,3681,10,0.2500000000,0.425000000,dat brengen mij automatisch bij een aantal duidelijk vragen .,PRP VBZ PRP JJ IN DT NN JJ VB .,dat_PRP brengen_VBZ mij_PRP automatisch_JJ bij_IN een_DT aantal_NN duidelijk_JJ vragen_VB ._.,NFS
3667,"Mijnheer de voorzitter, mijnheer de minister, ik dank u voor uw uitermate constructief antwoord.",1694,3667,17,0.1000000000,0.400000000,"mijnheer de voorzitter , mijnheer de minister , ik danken u voor uw uitermate constructief antwoord .","NN DT NN , NN DT NN , PRP VBP PRP IN PRP$ RB NN NN .","mijnheer_NN de_DT voorzitter_NN ,_, mijnheer_NN de_DT minister_NN ,_, ik_PRP danken_VBP u_PRP voor_IN uw_PRP$ uitermate_RB constructief_NN antwoord_NN ._.",NFS
3279,"Mevrouw Gantois, ik zal bijzonder aandachtig zijn voor de opvolging daarvan.",1552,3279,13,0.7000000000,1.000000000,"mevrouw gantois , ik zullen bijzonder aandachtig zijn voor de opvolging daarvan .","NN NNP , PRP MD JJ JJ PRP IN DT NN RB .","mevrouw_NN gantois_NNP ,_, ik_PRP zullen_MD bijzonder_JJ aandachtig_JJ zijn_PRP voor_IN de_DT opvolging_NN daarvan_RB ._.",NFS
3096,Ik heb net gezegd dat wij geen specifieke rol spelen in de uitwijzingsprocedure.,1470,3096,14,0.2750000000,0.525000000,ik hebben net zeggen dat wij geen specifiek rol spelen in de uitwijzingsprocedure .,PRP MD RB VBN CC PRP PRP JJ NN VB IN DT NN .,ik_PRP hebben_MD net_RB zeggen_VBN dat_CC wij_PRP geen_PRP specifiek_JJ rol_NN spelen_VB in_IN de_DT uitwijzingsprocedure_NN ._.,UFS
3688,Wij zullen nauw samenwerken in de commissie om tot de juiste resultaten te komen.,1705,3688,15,0.2500000000,0.550000000,wij zullen nauw samenwerken in de commissie om tot de juist resultaat te komen .,PRP MD JJ VB IN DT NN CC IN DT JJ NNS TO VB .,wij_PRP zullen_MD nauw_JJ samenwerken_VB in_IN de_DT commissie_NN om_CC tot_IN de_DT juist_JJ resultaat_NNS te_TO komen_VB ._.,NFS
3005,"In 2013 werd in Antwerpen vijf ton drugs in beslag genomen, vorig jaar 30 ton, dat is een verzesvoudiging.",1436,3005,22,0.0000000000,0.050000000,"in 2013 worden in antwerpen vijf ton drug in beslag nemen , vorig jaar 30 ton , dat zijn een verzesvoudiging .","IN CD MD IN NNP CD NN NNS IN NN VBN , JJ NN CD NN , PRP MD DT NN .","in_IN 2013_CD worden_MD in_IN antwerpen_NNP vijf_CD ton_NN drug_NNS in_IN beslag_NN nemen_VBN ,_, vorig_JJ jaar_NN 30_CD ton_NN ,_, dat_PRP zijn_MD een_DT verzesvoudiging_NN ._.",CFS
3730,"De afgelopen weken hebben aangetoond dat informatie-uitwisseling belangrijk is, intern in ons land, maar uiteraard ook met het buitenland.",1720,3730,22,0.3500000000,0.850000000,"de aflopen week hebben aantonen dat informatie-uitwisseling belangrijk zijn , intern in ons land , maar uiteraard ook met het buitenland .","DT VBN NNS MD VBN PRP NN NN MD , JJ IN PRP NN , CC RB RB IN DT NN .","de_DT aflopen_VBN week_NNS hebben_MD aantonen_VBN dat_PRP informatie-uitwisseling_NN belangrijk_NN zijn_MD ,_, intern_JJ in_IN ons_PRP land_NN ,_, maar_CC uiteraard_RB ook_RB met_IN het_DT buitenland_NN ._.",NFS
3040,Die moeten de handen in elkaar slaan om de drieste strijd tegen de drugs te winnen.,1445,3040,17,-0.7000000000,0.800000000,die moeten de hand in elkaar slaan om de driest strijd tegen de drug te winnen .,PRP MD DT NNS IN PRP VB CC DT JJS NN IN DT NNS TO VB .,die_PRP moeten_MD de_DT hand_NNS in_IN elkaar_PRP slaan_VB om_CC de_DT driest_JJS strijd_NN tegen_IN de_DT drug_NNS te_TO winnen_VB ._.,NFS
3803,De mensen op het terrein verdienen onze absolute steun.,1743,3803,10,0.1000000000,0.700000000,de mens op het terrein verdienen onze absoluut steun .,DT NNS IN DT NN VB PRP$ JJ NN .,de_DT mens_NNS op_IN het_DT terrein_NN verdienen_VB onze_PRP$ absoluut_JJ steun_NN ._.,NFS
4037,"Men heeft daar inderdaad niet veel energie nodig, want iedereen rijdt er nog met paard en kar.",1831,4037,19,0.2500000000,0.350000000,"men hebben daar inderdaad niet veel energie nodig , want iedereen rijden er nog met paard en kar .","PRP MD RB RB RB CD NN JJ , CC PRP VBZ RB RB RP NN CC NN .","men_PRP hebben_MD daar_RB inderdaad_RB niet_RB veel_CD energie_NN nodig_JJ ,_, want_CC iedereen_PRP rijden_VBZ er_RB nog_RB met_RP paard_NN en_CC kar_NN ._.",NFS
3591,"Mijnheer de minister, u doet dat totaal niet.",1664,3591,10,0.1000000000,0.400000000,"mijnheer de minister , u doen dat totaal niet .","NN DT NN , PRP VBP PRP JJ RB .","mijnheer_NN de_DT minister_NN ,_, u_PRP doen_VBP dat_PRP totaal_JJ niet_RB ._.",NFS
